content_id,status,source,message,title
126,ok,cache,cached (6816592 bytes),Corporate Retreat Planning Colorado 2026 | Book Your Team Offsite Now
246,ok,cache,cached (34223508 bytes),Fall Color Road to Mountain Wellness Retreat Near Aspen Colorado | Beyul Retreat
239,ok,cache,cached (348611 bytes),Mountain Wedding Reception in Aspen Grove | Intimate Colorado Wedding Venue Near Aspen
241,ok,cache,cached (2146048 bytes),Intimate Colorado Mountain Wedding at Beyul Retreat Near Aspen | Pond Ceremony Site
222,ok,cache,cached (6144276 bytes),Winter Wedding at Mountain Cabin Retreat Near Aspen | Beyul Retreat Colorado
223,ok,cache,cached (6333594 bytes),Winter Wedding Ceremony in Colorado Forest | Intimate Mountain Wedding Venue Near Aspen
243,ok,cache,cached (224950 bytes),Whimsical Wedding Toasts in the Aspen Grove | Colorado Mountain Wedding Venue
244,ok,cache,cached (555464 bytes),Mountain Wedding Details | Intimate Colorado Wedding Venue Near Aspen | Beyul Retreat
225,ok,cache,cached (612499 bytes),Wildflower Wedding Arch | Intimate Mountain Wedding Venue Near Aspen Colorado
245,ok,cache,cached (1259897 bytes),Intimate Fall Wedding in Aspen Grove | Colorado Mountain Wedding Venue Near Aspen
247,ok,cache,cached (33439538 bytes),Golden Hour Pond at Beyul Retreat | Colorado Mountain Wedding Venue Near Aspen
228,ok,cache,cached (468759 bytes),Intimate Mountain Wedding Venue Near Aspen | Beyul Retreat Colorado
249,ok,cache,cached (4969384 bytes),Fall Cabin Retreat in Aspen Grove Colorado | Beyul Retreat Wedding & Group Venue
601,FAILED,,got HTML interstitial (1214763 bytes),Intimate Mountain Wedding Ceremony Colorado | Beyul Retreat Near Aspen
602,FAILED,,got HTML interstitial (1213662 bytes),Mountain Wedding Reception Table | Intimate Colorado Wedding Venue Near Aspen
603,FAILED,,got HTML interstitial (1214893 bytes),Intimate Mountain Wedding by the Pond | Colorado Wedding Venue Near Aspen
604,FAILED,,got HTML interstitial (1214643 bytes),Intimate Colorado Mountain Wedding Elopement with Canoe on Pond | Fall Wedding Near Aspen
605,FAILED,,got HTML interstitial (1226225 bytes),Mountain Wedding Venue Colorado | Intimate Cabins Near Aspen & Basalt
606,FAILED,,got HTML interstitial (1214703 bytes),Mountain Wedding Reception Under the Aspens | Colorado Wedding Venue Near Aspen
607,FAILED,,got HTML interstitial (1224988 bytes),Intimate Mountain Wedding Details | Colorado Wedding Venue Near Aspen
608,FAILED,,got HTML interstitial (1213965 bytes),Intimate Mountain Wedding Ceremony Near Aspen | Colorado Wedding Venue
609,FAILED,,got HTML interstitial (1214662 bytes),Spring Meditation Trail Colorado | Aspen Grove Wellness Retreat Near Basalt
610,FAILED,,got HTML interstitial (1213513 bytes),Colorado Mountain Retreat for Digital Detox | Beyul Retreat Near Aspen
611,FAILED,,got HTML interstitial (1214876 bytes),Aspen Grove Wedding Ceremony in the Colorado Rocky Mountains | Beyul Retreat
612,FAILED,,got HTML interstitial (1214439 bytes),Aspen Grove Wedding Venue Colorado | Mountain Retreat Near Aspen | Beyul Retreat
